Category,Title,Image URL,Article URL,Content,News Provider
sports,"DOGE Committee to hold hearing on trans athletes in women's sports, congressman reveals",https://static.foxnews.com/foxnews.com/content/uploads/2024/06/timburchett.jpg,https://www.foxnews.com/sports/doge-committee-hold-hearing-trans-athletes-womens-sports-congressman-reveals,"Rep. Tim Burchett, R-Tenn., announced the DOGE Committee, the House subcommittee focused on delivering government efficiency, will hold a hearing on keeping men out of women's sports.
Burchett posted a video to his X account explaining important initiatives this week, leading with this hearing.
""We're seeing how crazy that's gotten with Riley Gaines and the rest of the crew that really put it out to the public,"" Burchett said.
CLICK HERE FOR MORE SPORTS COVERAGE ON FOXNEWS.COM
""The president has issued an executive order, which some people are ignoring. We're going to hear some really horrific stories of young ladies who really had their careers stolen from them, and some of them, their health.""
Burchett has been proactive prior to President Donald Trump's executive order, ""No Men in Women's Sports,"" being signed.
Burchett voted in favor of H.J.Res. 165, which would overturn a Biden administration rule that allowed men who identified as women to be protected under Title IX of the Civil Rights Act.
TRUMP MOCKS TRANS ATHLETES IN WOMEN'S SPORTS TO ROARING APPLAUSE AT ALABAMA COMMENCEMENT SPEECH
""Title IX of the Civil Rights Act was passed to protect women from being unfairly denied opportunities in education and sports. Allowing men to compete in women's sports takes trophies, changes, and even careers away from hardworking female athletes."" Burchett said during his debate remarks on the House floor in July 2024.
The bill eventually passed, 210-205.
Trump's executive order was signed in February on National Girls and Women in Sports Day, which celebrates female athletes in women's sports and those committed to providing equal access to sports for all females.
""This doesn't have to be long. It's all about common sense,"" Trump said before signing the order.
""The war on women's sports is over,"" he added.
One day later, the NCAA revised its gender eligibility policy to restrict participation in the women's category to only biological females. However, the new policy has been criticized by some women's sports activists for not going far enough.
Still, several states, including California and Maine, are not abiding by the executive order.
Trump recently spoke at the University of Alabama during its graduation ceremony, where he gave a shoutout to the school's SEC-champion women's track and field team. He used that to segue into his vow to ""defend women's sports.""
""As long as I'm president, we will always protect women's sports. Men will not play in women's sports,"" Trump said before the crowd erupted in cheers.
CLICK HERE TO GET THE FOX NEWS APP
""No way. They say it's an 80-20 issue. No, it's a 97-3 issue, I think,"" Trump added. ""No, men will not be playing in women's sports. I said that, and I classified it with a very powerful executive order, as you know. It's done.""
Fox News' Ryan Gaydos and Jackson Thompson contributed to this report.
Follow Fox News Digital's sports coverage on X, and subscribe to the Fox News Sports Huddle newsletter.",n/a
sports,Portuguese title on the line as Benfica host rivals Sporting,https://www.reuters.com/resizer/v2/KALYK5NIVNMMDFWCSQOCMWWLNQ.jpg?auth=85192040b330c7f275e8f26b55e84f6ac495e28d08cb7a27cfe2718d4735b982&height=1005&width=1920&quality=80&smart=true,https://www.reuters.com/sports/soccer/portuguese-title-line-benfica-host-rivals-sporting-2025-05-08,"May 8 (Reuters) - Sporting and Benfica lock horns in a Lisbon derby on Saturday that could decide the Portuguese league title with a game left in one of the closest races the country has seen in years.
The Portuguese capital rivals both have 78 points, with Sporting top by virtue of winning the first clash between the teams 1-0 at the Jose Alvalade stadium back in December.
If Sporting win on Saturday they will be champions, while if Benfica triumph by at least a two-goal margin they will reclaim the title with a superior head-to-head record.
A one-goal victory for Benfica would mean the title being decided next weekend when goal difference could come into play, with Sporting currently three goals better off than Benfica.
If the match is drawn, Sporting will retain the title by at least matching their rival's result on the final matchday.
With third-placed Porto long out of the title race, trailing 13 points behind the top two and level on 65 points with Braga, the Lisbon rivalry between Benfica and Sporting has dominated the campaign and not only in the league.
Benfica beat Sporting on penalties in the League Cup final in January and they will meet again at the iconic Jamor National Stadium in the Portuguese Cup final on May 25.
It will be a clash of two coaches who took charge of struggling sides in mid-season and got them back on track.
Rui Borges in late December replaced Joao Pereira, who lasted only 42 days after he was named Sporting manager following Ruben Amorim's move to Manchester United.
Amorin left Sporting in comfortable position at the top but a series of bad results forced the club to make a quick change and hire the 43-year-old Borges from Vitoria Guimaraes.
Sporting were already feeling the heat from Bruno Lage's Benfica, who was hired in September for a second tenure after Roger Schmidt was fired only four matchdays into the season.",n/a
sports,Fencing Is the Latest Sport Caught in the Transgender Athlete Debate,https://static01.nyt.com/images/2025/05/06/multimedia/06transgender-fencing-02-kvbh/06transgender-fencing-02-kvbh-facebookJumbo.jpg,https://www.nytimes.com/2025/05/06/us/trump-transgender-athletes-fencing-olympics.html,"A forfeited match and a viral video. An angry knock on the door. Death threats. An avalanche of political pressure, leading to a hearing scheduled for Wednesday in Washington.
The niche sport of fencing is usually not one that elicits fevered emotion beyond the thrust and parry of its matches. But it has become the latest sporting flashpoint following President Trump's executive order in February to block transgender athletes from competing in girl's and women's sports events.
Athletes have been affected at the youth, high school and college level, but the cultural firestorm has extended to all levels and types of competition, including Olympic sports.
The Trump administration is seeking to restrict who will be eligible to compete in women's events at the 2028 Summer Olympics in Los Angeles, which will include fencing competition. It has ordered American consulates to deny visas to transgender athletes who seek to enter the United States for sports events.",n/a
sports,President Donald Trump plans to create commission on college athletics: Sources,https://static01.nyt.com/athletic/uploads/wp/2025/05/07195107/GettyImages-2213213417-scaled.jpg?width=1200&height=630&fit=cover,https://www.nytimes.com/athletic/6341165/2025/05/07/donald-trump-commission-on-college-athletics,"Former Alabama head coach Nick Saban and Texas Tech board of regents chairman Cody Campbell would co-chair the commission President Donald Trump is interested in forming to examine the long list of issues facing college sports, a source briefed on the plans told The Athletic.
The source said Trump is expected to be 'very engaged' with the commission because he sees the current state of college sports as an issue of national importance.
Advertisement
The New York Times and Wall Street Journal reported Trump was interested in weighing in with an executive order after the president spoke last week with Saban, who has expressed concern that college sports is being harmed by the big money pouring into it to compensate athletes with little regulation. Yahoo! Sports first reported Wednesday that Trump is planning to create a presidential commission to examine a long list of issues facing college sports, from booster-funded payments and transfer rules to conference alignment and Title IX.
Campbell, who was elected chairman of the Texas Tech board of regents last month, is a former Red Raiders football player and one of the university's most prominent donors. He is the co-founder and co-executive of Double Eagle Energy Holdings, an upstream oil and gas company based out of Fort Worth, Texas, which operates extensively in the Permian Basin region of West Texas. Campbell is also the co-founder of the Matador Club, an NIL collective that supports Texas Tech athletics, and he recently spearheaded the new $242 million south endzone project at Tech's Jones AT&T Stadium, which overlooks Cody Campbell Field.
In February, Double Eagle sold a development for $4.1 billion, and in 2021, the company sold a previous development for $6.4 billion. Last month, Double Eagle announced a continued and expanded partnership with EnCap Investments, a prominent private equity company that specializes in the oil and gas industry. Campbell is a board member of Texas Public Policy Foundation and a distinguished fellow at the America First Policy Institute, the latter which has been integral to President Trump's second-term policy agenda.
A presidential commission would typically dig into various aspects of an issue or enterprise and deliver a report suggesting possible solutions that could involve executive and legislative action. Earlier this month, Trump signed an executive order creating the Religious Liberty Commission.
Advertisement
A spokeswoman for Rep. Michael Baumgartner, a freshman Republican from Washington who recently put forth an expansive bill to reform college sports, said he welcomed Trump's involvement.
'College sports is a highly subsidized public good and should be regulated like the public good it is. A presidential commission offers the chance to bring fiscal sanity; restore regional conferences and competitive balance; and protect the future of non-revenue and Olympic sports,' the spokeswoman said in a statement to The Athletic.
It's unclear how a commission would impact the current developments in college sports, including a potential landmark agreement to settle a trio of antitrust lawsuits facing the NCAA and major conferences and establish for the first time a system of direct payments from schools to athletes.
The settlement awaits final approval from a federal judge, who ordered the defendants to tweak part of the agreement that sets new roster limits for NCAA Division I schools that opt into the deal.
The latest revised filing has been made in the House v. NCAA settlement, regarding roster limits.
Any athlete who has been or would have been cut as a result of the settlement can be ""grandfathered in,"" meaning they will not count against the new roster limits for the duration… pic.twitter.com/Wco5hLoVyt
— Justin Williams (@Williams_Justin) May 7, 2025
College sports leaders and attorneys for the defendants remain confident the judge will sign off on the deal.
Even if the settlement is approved, college sports leaders have acknowledged that it will need the backing of federal legislation, which they have been, for years, lobbying Congress for.
Tom McMillen, the former Democratic congressman who for several years led an association of athletic directors whose schools compete at the highest level of Division I, praised Trump for getting involved.
Advertisement
'I give President Trump a lot of credit. This is a time to bring the best minds in college sports together, in higher education, and figure a model out,' said McMillen, who has known Trump for more than 50 years.
'He's always had a big interest in sports. It really fits his kind of whole M.O.'
Applauding @POTUS Trump for considering a presidential commission on college sports—something I first called for 11 years ago. The conversation is long overdue.👇 https://t.co/7W7ZyFdpFE https://t.co/EsKuyM0Ssy
— Tom McMillen (@TomMcMillen611) May 7, 2025
McMillen first called for a presidential commission on college sports more than a decade ago. He said that while there has been some progress toward a bipartisan bill in Congress, with Sen. Ted Cruz (R-Texas) and Sen. Cory Booker (D-N.J.) leading the efforts, presidential leadership could help prioritize the issue for Congress.
'I've always said you're going to need a presidential push to get something done,' said McMillen, who was a star basketball player at Maryland, a longtime NBA player and member of the 1972 Olympic team.
He also recalled how a commission on Olympic Sports that was formed by President Gerald Ford in 1975 led to the Amateur Sports Act of 1978 and substantive reform that boosted the United States' performance in subsequent games.
A commission on college sports could help lead to long-term reform without interrupting what is already in motion, McMillen said.
'Not gonna be overnight, but it could be very, very symbolic and very significant for higher ed and college sports, and for America,' McMillen said.
— Chris Vannini, Justin Williams and Sam Khan Jr. contributed to this story.",n/a
sports,Pennsylvania Senate approves bill to ban transgender athletes in girls' sports,https://assets2.cbsnewsstatic.com/hub/i/r/2025/01/02/03a331a8-08d2-4252-818e-b5fdd227e187/thumbnail/1200x630/008da627be40780edc19f12a97c1f23e/file-harrisburg-pa-capitol-frame-53.jpg?v=8782d831dd587e69db5d043c0a4c5f4b,https://www.cbsnews.com/pittsburgh/news/pennsylvania-senate-ban-transgender-athletes-girls-sports,"Pennsylvania's state Senate on Tuesday approved a bill to ban transgender athletes from competing in women's and girls' sports at the collegiate and K-12 levels, although the Republican-penned bill is unlikely to get a vote in the state's Democratic-controlled House of Representatives.
The bill passed, 32-18, with five Democrats crossing party lines to join with all 27 Republicans in voting ""yes."" The vote marked the second time the GOP-controlled Senate has passed it. An earlier attempt, in concert with a Republican-controlled House, met then-Gov. Tom Wolf's veto pen in 2022.
This time, Senate Republicans are advancing the effort after President Donald Trump declared his intent to ""keep men out of women's sports."" and made it a major campaign issue in last year's election, dividing Democrats on how to respond.
The bill applies to participation in girls' and women's sports that are sponsored by public schools, public universities and publicly chartered community colleges.
It also prohibits any sort of government agency or athletic association from investigating or punishing a school or higher education institution for maintaining separate sports teams for girls or women.
For well over an hour, Republicans and Democrats debated the bill, at times hotly. The sponsor, Sen. Judy Ward, a Republican from Blair County, said the bill would ""ensure all young women have a fair chance to compete in the sports they love.""
Ward said that since 2020 in Pennsylvania, 37 female athletes have lost first place and another 13 lost second or third place, although she didn't say from where she drew the statistics. Pennsylvania's governing body for high school sports, the Pennsylvania Interscholastic Athletic Association, said it was aware of just one transgender student currently participating in sports.
Senate Minority Leader Jay Costa, a Democrat from Allegheny County, called the bill discriminatory against transgender people, as well as ""unnecessary, unwarranted and unconstitutional in my mind.""
Democrats warned that the bill will go nowhere in the House, and a spokesperson for House Democratic leaders accused Senate Republicans of being ""more focused on divisive political theater and bullying kids for political points.""
Gov. Josh Shapiro's office did not respond to an inquiry Tuesday about the bill, although the Democrat has in the past expressed opposition to such bans, calling 2022's bill ""nothing more than cruel, designed to discriminate against transgender youth who just want to play sports like their peers.""
Trump, as president, signed an executive order intended to ban transgender athletes from participating in girls' and women's sports.
In February, the PIAA changed its policy in a move that some officials said was designed to follow Trump's order, except that lawyers on both sides of the issue say the change in policy wording does nothing of the sort.
Previously, the PIAA's policy had deferred to school principals to determine an athlete's ""gender"" when ""questioned or uncertain."" It changed the policy to defer to principals to determine a student's ""sex"" when ""questioned or uncertain,"" and added a line that says that, in accordance with Trump's executive order, ""schools are required to consult with their school solicitors relative to compliance with the order.""
In response to Trump's order, the NCAA revised its transgender participation policy to limit women's college sports to athletes assigned as female at birth. The National Association of Intercollegiate Athletics, a governing body for smaller schools, effectively banned transgender athletes in 2023 from women's sports.",n/a
sports,Ex-NFL player speaks out against college athlete revenue sharing with landmark Supreme Court ruling pending,https://static.foxnews.com/foxnews.com/content/uploads/2025/02/supreme-court.jpg,https://www.foxnews.com/sports/ex-nfl-player-speaks-out-against-college-athlete-revenue-sharing-landmark-supreme-court-ruling-pending,"The age of athlete compensation in college sports could get a lot more complicated with a pending Supreme Court decision.
A settlement in the case of House v. NCAA would allow all Division I schools to share revenue directly with student athletes if it receives final approval this month.
The current system of NIL compensation, in effect since summer 2021, has faced its share of scrutiny. But universities paying athletes directly would all but erase the ""amateurism"" that historically defined American college sports.
CLICK HERE FOR MORE SPORTS COVERAGE ON FOXNEWS.COM
Former NFL and college football player Jack Brewer is heavily opposed to the concept.
""We need to get back to student-athletes,"" Brewer told Fox News Digital.
""If a person wants the freedom to make as much money as they want and can leverage the sport to do that, they should absolutely be able to — and they can, in our professional leagues. But there's no place for an unlimited amount of money to be paid to people in college sports. They should be student-athletes, which is what they signed up to be.""
FLORIDA'S WALTER CLAYTON JR. RECALLS FINAL AGAINST HOUSTON
Brewer argued that revenue sharing would worsen a problem created by NIL since its 2021 legalization — declining graduation rates.
""You'll continue to see students who are no longer focused on school because their incentive for going to college is no longer to get an education, but to make money,"" Brewer said. ""It's not right for universities to exploit this loophole, recruiting student-athletes who no longer have to focus on being students.""
CLICK HERE TO GET THE FOX NEWS APP
President Donald Trump was considering an executive order to regulate name, image and likeness in college sports after meeting with the legendary Alabama Crimson Tide coach, the Wall Street Journal reported last week
Follow Fox News Digital's sports coverage on X , and subscribe to the Fox News Sports Huddle newsletter .",n/a
sports,Sporting made to wait for title after Benfica earn derby draw,https://www.reuters.com/resizer/v2/MLBGLPZBJJM43P2B7YBHGMT2UA.jpg?auth=eb75080d99cacc3ac5fdb4c8b4f16535f73ff5a6229d562596a308ec6b8a9d8c&height=1005&width=1920&quality=80&smart=true,https://www.reuters.com/sports/soccer/sporting-made-wait-title-after-benfica-earn-derby-draw-2025-05-10,"May 10 (Reuters) - Sporting will have to wait until the final day of the Primeira Liga season as they bid to retain their title after being held to a 1-1 draw at second-placed rivals Benfica on Saturday.
The Portuguese capital pair started the match level on points but Sporting, with the advantage due to their head-to-head record, edged closer to a 21st league title when Francisco Trincao fired them into the lead after four minutes.
Benfica equalised in the 63rd through Kerem Akturkoglu's tap-in from close range after Vangelis Pavlidis sliced through Sporting's defence with a dazzling solo run, bringing the home crowd at the Estadio da Luz back to life.
Sporting remain in pole position and will clinch the title by at least matching Benfica's result on the final day. They host Vitoria Guimaraes while Benfica visit Sporting Braga in what will be a dramatic conclusion to the season next Saturday.",n/a
sports,"Jemele Hill returns to ESPN's 'Around the Horn' before show's cancellation, jokes about previous firing",https://static.foxnews.com/foxnews.com/content/uploads/2024/09/Jemele-Hill.jpg,https://www.foxnews.com/sports/jemele-hill-returns-espns-around-horn-before-shows-cancellation-jokes-about-previous-firing,"ESPN's ""Around the Horn"" is bringing back some of its old faces before its final show.
ESPN announced the show's cancellation in March, and its last show will be on May 23. So, on Thursday's episode, they brought back Jemele Hill, who anchored SportsCenter for a time before she was canned in 2018.
Hill was let go from the network due to social media posts about President Donald Trump and his supporters during his first presidency.
During the episode, host Tony Reali and the other panelists had a segment where they reacted to old takes from her, and Hill could not help but laugh at herself.
""I got a little bit nervous when I saw you were pulling up our tweets. Dude, I just came back, man!"" she said.
The episode also featured the return of Kate Fagan, who left the network in 2018. Fagan made a plea for ""trans kids"" in sports.
""I know it's my last time on [the show], and I want to say something worthy of that platform, and that's trans kids deserve to play sports,"" she said. ""Think about what you remember from your time playing sports. Ninety-nine percent of it is finding that jersey for the first time, your favorite number, community, joy, those high-fives.
""It's that moment when you have a great play with a teammate. It's the feeling of belonging. And it does not know gender. Trans kids deserve the same as everyone else does… Sports is joy. Sports is humanity. And the more people who have that, the better.""
There is no law or order that bans transgender children from participating in sports. Trump signed an executive order in February that prohibits biological males identifying as girls or women from competing against biological females.
Shortly after it was announced the show was ending, former panelist Jay Mariotti, who was a regular on the show until a domestic violence arrest in 2010, said in an interview the show is being canceled because it went ""woke.""
There are now just 11 episodes left of the show, which is over 20 years old.
Follow Fox News Digital's sports coverage on X, and subscribe to the Fox News Sports Huddle newsletter.",n/a
