Category,Title,Image URL,Article URL,Content,News Provider
sports,ESPN panelist says 'trans kids deserve to play sports' in final appearance before show's cancellation,https://static.foxnews.com/foxnews.com/content/uploads/2025/02/gettyimages-2197258245.jpg,https://www.foxnews.com/sports/espn-panelist-says-trans-kids-deserve-play-sports-final-appearance-before-shows-cancellation,"""Around the Horn"" leaves the airwaves later this month, which means some of the show's panelists are making their final appearances in the coming weeks.
That includes Kate Fagan, who appeared for the last time on the show Thursday. Fagan, a longtime writer and reporter, also played college basketball at Colorado.
Fagan has made appearances on the show since she was first hired by ESPN in 2012. She left the network in 2018 but has continued to appear on the program.
Fagan was determined to be the ""winner"" of Thursday's show against Jemele Hill, who made a return to the show since leaving the network in 2018. The winner of the episode typically delivers a short monologue, and Fagan said ""being on this show has been a privilege and a platform.""
With Thursday marking her final episode, she used that platform to make a plea for transgender athletes.
""I know it's my last time on it, and I want to say something worthy of that platform, and that's trans kids deserve to play sports,"" she said. ""Think about what you remember from your time playing sports. Ninety-nine percent of it is finding that jersey for the first time, your favorite number, community, joy, those high-fives.
""It's that moment when you have a great play with a teammate. It's the feeling of belonging. And it does not know gender. Trans kids deserve the same as everyone else does.
""Sports is joy. Sports is humanity. And the more people who have that, the better.""
There is no law or order that bans transgender children from participating in sports. President Donald Trump signed an executive order in February that prohibits biological males identifying as girls or women from competing against biological females.
ESPN announced the show's cancellation in March, and shortly after, former panelist Jay Mariotti, who was a regular on the show until a domestic violence arrest in 2010, said in an interview the show is being canceled because it went ""woke.""
""I think what John Skipper wanted from some of the shows was he started to install people on the shows who became anti-Trump,"" Mariotti told Front Office Sports.
In a recent post on his own Substack, ""Around the Horn ended a long time ago ¸— when I left the show,"" Mariotti reiterated that some of the panelists went ""woke"" while others were ""on dope.""
There are now just 11 episodes left of the show, which is over 20 years old.
Follow Fox News Digital's sports coverage on X, and subscribe to the Fox News Sports Huddle newsletter.",n/a
sports,India's icy indifference to winter sport frustrates trailblazer Keshavan,https://www.reuters.com/resizer/v2/AMFRN73QYNKAFDBAVL4JSUQAG4.jpg?auth=3df657fad61b01f917fbf924b539bffcee9d732698beaa7b908a00409371c023&height=1005&width=1920&quality=80&smart=true,https://www.reuters.com/world/india/indias-icy-indifference-winter-sport-frustrates-trailblazer-keshavan-2025-05-06,"NEW DELHI, May 6 (Reuters) - Twenty seven years since his Winter Olympics debut with a borrowed sled in Nagano, Shiva Keshavan cannot help feeling that the more things change, the more they remain the same.
The former luger knows what it feels to be the only Indian in an Olympic Village - he was a one-man team in the first two of his six appearances at the Winter Games.
here.
Likewise, Alpine skier Arif Mohammad Khan was the only Indian at the 2022 Beijing Games in Beijing and could be again next year in Milan-Cortina, Italy.
""Fundamentally, nothing has changed,"" Keshavan told Reuters from Italy, the birthplace of his mother. ""Fundamentally, we are still struggling to get off the starting blocks.
""Right now, (winter sport) athletes are coming up despite the system, not because of the system.""
The system is largely on paper.
India has only a handful of ski resorts, three indoor ice rinks, one certified Alpine slope, and no culture of winter sports.
""You cannot practise in a pond and hope to win an Olympic medal in swimming,"" Ice Hockey Association of India secretary general Harjinder Singh told Reuters.
There are also luge and ski federations but none enjoy the National Sports Federation (NSF) status that would entitle them to regular government funds because not enough states participate in their sports.
Keshavan often competed with borrowed sleds and hand-me-down jackets. He had to crowdfund some of his Olympic trips and had thousands of names of donors etched on his suit at the 2014 Sochi Games.
The cricket-mad nation has warmed up to the Summer Olympics and is even preparing a bid for the 2036 Games but winter sports continue to languish outside public consciousness.
""We are missing some very basic steps,"" Keshavan said.
""There's no official recognition of any single winter sport and unless that changes, nothing will change.""
Despite being one of the world's most populous nations, it took India four decades to send their first athlete to the Winter Olympics in Innsbruck in 1964.
Alpine skier Jeremy Bujakowski, who was born to Polish parents in Lithuania before moving to India, failed to finish either of his events and was 53rd and 65th when he returned to the Olympics in 1968, again alone.
NO MEDAL
It was to be another two decades until India was again represented with the first woman, Shailaja Kumar, among the three alpine skiers at the 1988 Games in Calgary.
Keshavan made his debut at the 1998 Games and was part of the record contingent of four athletes that went to the 2006 Turin Games.
In all, there have been 16 Winter Olympians from India. None has won a medal.
Reuters reached out to several Indian Olympic Association officials, including president PT Usha, but none was available to comment.
""Obviously, the scope for winter sports is limited to certain areas but the population of those areas will outnumber many European nations,"" Keshavan, 43, said.
The buzz around India's 2036 Olympic bid makes him optimistic that the prevailing frost of apathy towards winter sports may have started thawing.
""The world knows that India is a sleeping giant in sports,"" he said.
""It's only now that we've really started talking in bigger terms. It's only now that we've started talking about hosting Olympics.
""People now beginning to realise it's not just about winning medals, it's about creating a healthy nation.""
Ice hockey chief Singh is hoping a new sports bill, currently being prepared by the government, would tweak rules and grant the NSF status to the IHAI and other winter sport federations.
""I was asked to give my suggestions. Hopefully something good will come out of this new bill,"" he said.",n/a
sports,"Olympians, national champions join Hulk Hogan's Real American Freestyle",https://static.foxnews.com/foxnews.com/content/uploads/2025/05/kyle-snyder.jpg,https://www.foxnews.com/sports/olympians-national-champions-join-hulk-hogans-real-american-freestyle,"Real American Freestyle announced the additions of a handful of superstar champion wrestlers to its roster on Thursday with the first event only months away.
David Carr, Kyle Dake, Trent Hidlay, Kyle Snyder and Aaron Brooks will participate in the unscripted wrestling series. The five men enter the league via SuckerPunch Entertainment, a sports management agency that specializes in combat sports.
""David, Kyle, Aaron, Trent, and Kyle represent the best of the best, and that's who we're targeting for Real American Freestyle,"" pro wrestling legend Hulk Hogan, the commissioner of Real American Freestyle, said in a news release. ""Our goal is to give these athletes an opportunity to continue their careers, create a platform for greatness, and inspire a legacy that lasts
Carr was a two-time national champion at Iowa State as well as an under-20 world champion. Dake won a bronze medal at the Tokyo and Paris Olympics as well as a four-time national champion at Cornell.
Brooks was a four-time national champion at Penn State and won a bronze medal at the Paris Olympics. Hidlay was a four-time All-American but was never able to win the national championship at N.C. State. He won the ACC title four times.
Snyder is known as ""Captain America."" The former Ohio State star was the youngest-ever athlete to win a world, NCAA and Olympic championship in the same year. He was also the first Olympic gold medalist to return to college. He served on the President's Council on Sports, Fitness and Nutrition during President Donald Trump's first term.
Ben Askren, Kennedy Blades, Zahid Valencia were announced as the first wrestlers to join Real American Freestyle upon its launch.
Hogan and Eric Bischoff explained to Fox News Digital last month they are trying to make freestyle wrestling mainstream.
""It's a completely underserved sport, meaning there's no professional league that allows these amateurs to evolve like they would in any other sports and it's such an underserved market, and I know, having spent a little bit of time in amateur wrestling as a kid, these are unique athletes,"" Bischoff said.
""Every athlete is committed, they have to be disciplined, but there's something about individual sports, particularly, wrestling, it's just a different kind of grind, and you have to be wired a little differently to be successful at it.""
The first set of matches is set for Aug. 30.
Follow Fox News Digital's sports coverage on X, and subscribe to the Fox News Sports Huddle newsletter.",n/a
sports,Why African arm wrestling is growing in strength,"https://media.cnn.com/api/v1/images/stellar/prod/gettyimages-2079436497.jpg?c=16x9&q=w_800,c_fill",https://edition.cnn.com/sport/africa-arm-wrestling-olympics-asibey-spc-intl,"For an instantly recognizable contest that has settled untold scores it is, ironically, hard to get a firm grip on the origins of arm wrestling.
As host of the World Armwrestling Federation's (WAF) inaugural World Championship in 1979, the Canadian city of Wetaskiwin could claim to be the birthplace of the formal, global sport, yet descriptions of rivals locked in battles of the biceps stretch back much further.
Versions of arm wrestling had already taken root across Japan, Spain and Cuba before the turn of the 20th century, according to anthropologists of the time. Some have even claimed it is depicted in the hieroglyphs of ancient Egypt, though these assertions have been contested.
Whatever its place in arm wrestling's origin story, Africa is not looking back.
Last March saw the sport make its first appearance at the 13th African Games in Accra, Ghana, a debut orchestrated by Armwrestling Federation of Africa (AFA) President Charles Osei Asibey.
It was the latest step towards Asibey delivering on the promises of his 2022 election manifesto: to make arm wrestling a 'household' sport on the continent.
'Formerly in Africa, it was only a way to determine the strongest in the community, or even in schools,' Asibey told CNN. 'So people didn't even consider arm wrestling as a sport. It was just a normal game … We have turned it into a sport.'
The technical term for an arm wrestler is a 'puller' and it is technique, not raw power, that makes a champion, stresses Asibey, with training programs focused on developing all aspects of the body.
'A lightweight who is smarter, has speed, [and] can swing very well will beat a heavier weight,' explained Asibey, who competed until last year.
Such a matchup would not happen at the competitive level, with pullers classed into sex and weight categories, akin to boxing and mixed martial arts. And just as boxing has varying orthodox and southpaw stances, arm wrestling has its own battling styles that play to a puller's personal strengths.
The toproll style, for example, sees pullers turn their wrist inwards (pronation), and often lean back, to increase leverage, while the hook technique involves the outward rotation of the wrist (supination) to create a hook shape with the arm and pull the opponent in.
Taller pullers with long arm spans make natural toprollers, while the hook style can be hugely effective for those with a background in powerlifting, bench-pressing or similar disciplines that prioritize tricep strength.
During contests, the pullers' faces are a visceral picture of steely concentration, sinew-straining effort, and fierce competition, but it is the mutual respect that defines the sport for Asibey.
'Even in defeat, you congratulate your opponent,' he said. 'You get to the table, you shake hands … you go off the table, you shake hands and hug each other.'
Arm wrestling's debut at last year's African Games was a homecoming in all senses of the word for Asibey, with the Accra-born former broadcast journalist having founded the Ghana Armwrestling Federation in 2016.
The hosts amassed 41 of the 84 total arm wrestling medals. That put them comfortably clear of Egypt's 19-medal haul, but the North African nation gathered six more arm wrestling golds than Ghana to finish top of the medal table.
Two pullers in particular embodied the team's 'Golden Arms' moniker, accounting for half of Ghana's eight gold medals between them.
Men's captain Edward Asamoah powered to victory in the 90kg weight class for both left and right arms. A member of the Ghana Immigration Service, in 2017 Asamoah decided to try his luck at a national competition and set in motion a rollercoaster adventure.
'The journey hasn't been very smooth, with injuries and financing, but it was worth it,' he told CNN. 'Determination and hard work got me those medals.'
It has been a similar breakneck rise for Grace Minta, a police officer who followed up her two golds in Accra by becoming the first Ghanaian to win a World Armwrestling Championships gold, in Moldova five months later.
Having dominated continental events, becoming World Champion marked a new high for three-time African Championships gold medalist Minta, who took up the sport in 2017 after excelling in javelin and shotput at school.
'I'm so, so proud to be a Ghana arm wrestler,' Minta told CNN. 'I want to train the young ones who are coming, to organize them to also become somebody in the future.'
The challenge for Africa now is to replicate Minta's success more regularly — no easy feat given the established giants of the sport.
Kazakhstan dominated last year's world championships, scooping 52 golds as part of a 159-medal surge. Turkey and Georgia finished second and third in the medal leaderboard.
Egypt led the African contingent in 36th, two places ahead of Ghana, a fair reflection of their status as the 'top notch' arm wrestling outfit on the continent, according to Asibey.
He says that while Africa, which currently has nine nations signed up as members to the WAF, is well on its way, securing more funding will help close the gap to nations like Kazakstan which — partly thanks to the popularity of the sport in schools — sends more than 100 competitors to World Championship events.
'That's why they always dominate, because in those countries they have taken the sport very seriously,' Asibey said.
'The Africa Games brought a lot of good things. Governments and institutions have recognized us … (But) We don't have sponsorship yet. We struggle to raise money.'
'We are confident that where we are going, very soon, multinational or corporate institutions will come to invest in our sport,' he added.
Such backing would help Asibey to secure arm wrestling's African Games return in Cairo for 2027. But while that is his short-term focus, he has even bigger aspirations.
Though the WAF was unsuccessful in its bid to see para-armwrestling included in the 2028 Paralympic Games in Los Angeles, Asibey — who doubles as one of five WAF vice-presidents — believes it is just a matter of time before it makes the cut.
That will be one step closer to his ultimate goal of seeing pullers battle it out on the Olympic stage. By ensuring arm wrestling is a regular fixture at his own continental games, he believes he is doing his part to make that dream a reality in the near future.
'We are working so hard to be in the Olympics,' Asibey said. 'Very soon we will get there … (Then) I'll have a good sleep.'",n/a
sports,DICK's House of Sport officially unveils one-of-a-kind Paul Skenes rookie card,https://assets3.cbsnewsstatic.com/hub/i/r/2025/05/09/db9ffa6c-c531-4d2e-8ef0-421d66d0303f/thumbnail/1200x630/4f4cc76169076b6dba29bdc6a16b6058/paulskenesdisplay.png?v=e61856d8e666e7ed5709adc37bb2d465,https://www.cbsnews.com/pittsburgh/news/dicks-puts-paul-skenes-card-on-display,"Remember that Paul Skenes MLB Debut Card? The one that people were shelling out so much money to try and find?
Well now, DICK's House of Sport in Ross Township gets to house the card that everyone was looking for.
Pirates fans gather to get the first look
The line before opening wasn't around the block.
""I really wanted to see the card,"" Amy Boyle of Ross Township said.
This is still a dedicated bunch. Travis Rogan of Beaver County was first in line at 7:30 Friday morning.
""I was driving down into the city – and then I had some free time this morning after that, so I figured, why not come up here?"" Beaver said.
At 9 a.m., it was time to file in towards the shrine for the prized possession. Rogan, of course, got to walk up first.
""I was really taken – blown away at the level of care that went into the display of it,"" he said.
The display the card is in is made of tempered glass.
""It is actually non-breakable, it's ballistic proof – and in the actual casing around it is a 1500 pound safe,"" Toni Roeller, EVP of Store Experience and Design at DICK's Sporting Goods, said.
Among the caps and jerseys in that part of the store are also odes to our city.
""There's like the steel plate – as like a nod to Pittsburgh,"" Roeller said.
The people at DICK's say it means a lot for them, and the community.
""The fanhood of sports is so important for us – and we feel like this brings a special piece of sports history to our house of sports store in Pittsburgh,"" David Progar, Dick's Sporting Goods SVP of Team Sports, Licensed, and golf.
It's something the people in the bunch outside were amazed by.
""Really nice, it's great that it's here for everyone to see,"" Boyle said.
There could be a lot of people coming this weekend to see this card.
Just know that through the weekend – Dick's House of Sport in Ross Township will have a wristband process if you do want to come and see it.
Card nets $1.1 million at auction, comes home to Pittsburgh
In March, the card headed to auction, where bidding took place in a frenzy with prices rising quickly.
It would ultimately sell for $1.11 million to, at the time, an anonymous bidder.
Just hours after its sale was finalized, DICK's Sporting Goods announced they were the ones to pony up the more than $1 million.
""DICK'S is passionate about bringing fans closer to the game,"" said Ed Stack, Executive Chairman, DICK'S. ""Acquiring the Paul Skenes MLB Debut Patch card enables us to celebrate his incredible talent while giving our athletes a unique opportunity to experience a piece of baseball history up close. We're thrilled to bring this special card home and display it in our Pittsburgh House of Sport store, where it can inspire the next generation of athletes and collectors.""
California Collector turns down Pirates' massive offer for card
Early in 2025, the card that had been so coveted by millions since late 2024 was officially pulled by an 11-year-old card collector in California.
The Pirates stated on social media that if the person who found the card was willing to return it to the club, they would get:
Two Pirates season tickets behind home plate for 30 years
A softball game at PNC Park for 30 with coaching from Pirates alumni
A spring training experience that would include a meet-and-greet with Skenes, two Skenes autographed jerseys, and the chance to take batting practice and warmups with the team.
Dunne upped the stakes, saying that whoever found the card and returned it to the team could watch a game in her suite with her at PNC Park.",n/a
sports,Sporting KC becomes 1st MLS team to win a game without recording a shot on goal,https://statics.foxsports.com/www.foxsports.com/content/uploads/2025/05/sporting_kc_horizontal.jpg,https://www.foxnews.com/sports/maya-yoshida-own-goal-keeps-defendingchampion-galaxy-reeling-in-10-loss-to-sporting-kc,"Los Angeles Galaxy defender Maya Yoshida had the only score on Sunday night, but it was an own goal that led to a 1-0 victory for Sporting Kansas City. With the win, they made history, becoming the first MLS team to win a game without registering a shot on goal.
It was just the third win in 11 tries for Sporting Kansas City, this season, but their second in the last three games.
As for the Galaxy, they continued the worst start by a defending champion in league history. The Galaxy (0-8-3) are still looking for their first victory 11 matches into the season and even a 3-0-2 record in five previous matchups with Sporting KC (3-7-1) didn't help.
In the 13th minute, KC's Daniel Salloi sent in a cross on the ground, and it deflected off Maya Yoshida and into the net. There was no attacker near enough to the cross to threaten tapping it in, but Yoshida tried to make a defensive play and it went awry.
John Pulskamp had to make one save, and it came in the first half on the way to his second clean sheet in his 11th start of the season for Sporting KC. His save came just before halftime on a right-footed shot from the center of the box by John Nelson.
John McCarthy did not have a save for the Galaxy.
It was sweet revenge for Dejan Joveljic, who came to Sporting KC in the first cash-for-player trade in league history after helping the Galaxy win their sixth MLS Cup last season. He leads the team with five goals — all at home.
The Galaxy have missed Riqui Puig, who hasn't played since suffering a knee injury in the playoffs. And Joseph Paintsil and Gabriel Pec, who combined for 50 goals contributions in the championship run, have just four so far this season.
Sporting KC interim coach Kerry Zavagnin and the Galaxy's Greg Vanney were teammates on the US men's national team. The two coaches represented their current teams when the two clubs squared off in the conference final of the 2000 MLS Cup — won by the then-Kansas City Wizards, who went on to beat the Chicago Fire 1-0 in the championship match.
The Galaxy travel to play the New York Red Bulls on Saturday. Sporting KC travels to play the Portland Timbers on Saturday.
Want great stories delivered right to your inbox? Create or log in to your FOX Sports account, follow leagues, teams and players to receive a personalized newsletter daily!",n/a
