Category,Title,Image URL,Article URL,Content,News Provider
sports,"NFL on YouTube, Caitlin Clark, Nick Saban: This week's sports business case studies",https://static01.nyt.com/athletic/uploads/wp/2025/05/09114427/GettyImages-2212910061-scaled.jpg?width=1200&height=630&fit=cover,https://www.nytimes.com/athletic/6344781/2025/05/10/nfl-youtube-caitlin-clark-nick-saban-utah-mammoth-case-studies,"The Athletic reported out and published more than 60 stories this week covering the universe of sports business, across every sport. Each week, sports business editor Dan Shanoff picks out a few that intrigued him most.
Don't miss any of The Athletic's sports business coverage — if you have the app or are logged into the website, 'follow' the sports business category. Or simply bookmark this page to your home screen for easy access.
Advertisement
Our Andrew Marchand got the scoop: When the NFL announces its international games Tuesday, it is highly likely the Week 1 Friday prime-time game in Brazil will exclusively air on YouTube, the platform that eclipses every other video consumption/distribution network around the globe.
The game will be free for viewers. (Presumably, Google will be paying the NFL for the right to exclusively stream the game, as NBC did last year to get the Week 1 Brazil game on Peacock.) Last year's Week 1 game on Peacock had 14 million viewers, so imagine how many YouTube might be able to drive with virtually no barriers to viewing.
Why it's interesting to me: Industry observers have been waiting a long time for Google/YouTube to enter the exclusive live sports arena (and separate that from Google's deal with the NFL for rights to distribute the 'Sunday Ticket' package). You can understand why the NFL would be eager to do this — another deep-pocketed bidder for NFL rights only helps the league when those new rights come up for sale.
It is one thing for Caitlin Clark's WNBA games to top a million viewers during the regular season. It is another to top a million viewers for an otherwise anodyne Sunday afternoon preseason exhibition against a Brazilian national team with little to no name recognition among U.S. basketball fans. As noted in Richard Deitsch's coverage, that tops any NBA preseason game except two from LeBron James.
That made this game an incredible experiment for the preeminent sports media thesis: 'The Caitlin Clark effect is real.'
The main (if not only) reason to tune in last Sunday was to see Clark. Weird time slot. Not a ton of promotion. Anonymous opponent. And fans still sought it out. Now imagine a game in prime time against an opponent with an enthusiastic fan base of its own, like the defending champion New York Liberty or Angel Reese's Chicago Sky or A'ja Wilson's Las Vegas Aces.
It is an open question whether a network could air an Indiana Fever intra-team scrimmage and draw half a million people watching Clark. I'd take the over.
College football coaching legend Nick Saban (along with Texas Tech board chair Cody Campbell) would chair a new commission on college athletics that President Donald Trump is interested in forming.
Saban has been outspoken about the state of college sports, and Texas Tech has been at the forefront of tapping high-net-worth boosters to bolster its sports programs through new name, image and likeness rules (or lack thereof).
Advertisement
Will this commission have any actual formal power to create legislation? No. Will it be able to traverse the current gridlock to get Congress to agree on a national bill to adjust the college sports landscape? Again, almost certainly not. Will it add new complexity to an already-complicated college sports landscape? Surely!
I'm a branding enthusiast, so this week's reveal that Utah Hockey Club would be known as the 'Mammoth' was a notable development.
I'm a fan: Love that they went with the singular ('Mammoth') over the plural ('Mammoths') … love the logo (including, as others have noted, that subtle image of the state outline on the left side near the ear) … love the instant rallying cry, 'Tusks up!' (I am imagining a corresponding hand gesture that looks not unlike the way USC fans curl their index and middle fingers, although I'd flip it so that the fingertips are pointing toward your face.) I also love that the team was so open to including fan sentiment in the decision-making. Dan's branding grade: A-
1. Why tennis players and the ball disappear from your screen when watching matches (and what networks can do about it).
2. This behind-the-scenes look at how F1 partnered with Lego to create life-size versions of its race cars, made from Legos.",n/a
technology,UK's FD Technologies soars on possible $722 million buyout by private equity firm,https://www.reuters.com/resizer/v2/466BJJQ7PVGY5O53NZ3KL65MHM.png?auth=b9c3bf166c40a6778eb5672993fde7c30a15f48329026674eff92afd8da1d0ca&height=1005&width=1920&quality=80&smart=true,https://www.reuters.com/technology/uks-fd-technologies-soars-possible-722-million-buyout-by-private-equity-firm-2025-05-07,"May 7 (Reuters) - British data and analytics firm FD Technologies (FDPF.L), opens new tab said on Wednesday it is in advanced talks with American private equity firm TA Associates over a possible acquisition offer, valuing the firm at 541.6 million pounds ($722.77 million).
Shares of FD Technologies soared 19% to 23 pounds. The possible offer represents a premium of about 27% to the stock's last closing price.
The Technology Roundup newsletter brings the latest news and trends straight to your inbox. Sign up here.
TA Associates had proposed to buy the London-listed firm at 24.50 pounds per share in late March, a price at which the FD Technologies board was ready to recommend to shareholders if a formal offer was tabled, the company added.
The U.S. firm has until June 4 to make a formal offer or walk away, according to UK takeover rules.
($1 = 0.7493 pounds)",n/a
technology,AMETEK to acquire FARO Technologies in deal valued at $920 million,https://www.reuters.com/resizer/v2/466BJJQ7PVGY5O53NZ3KL65MHM.png?auth=b9c3bf166c40a6778eb5672993fde7c30a15f48329026674eff92afd8da1d0ca&height=1005&width=1920&quality=80&smart=true,https://www.reuters.com/markets/deals/ametek-acquire-faro-technologies-deal-valued-920-million-2025-05-06,"May 6 (Reuters) - Industrial tools maker AMETEK (AME.N), opens new tab will acquire FARO Technologies (FARO.O), opens new tab at an enterprise value of about $920 million, the two companies said on Tuesday, sending the target firm's shares soaring 36% before the bell.
Under the agreement, AMETEK is offering $44 per share in cash, representing about a 40% premium to FARO's last close. The equity valuation pegs FARO's market value at $846 million.
The acquisition is expected to be completed in the second half of the year.
FARO Technologies, which produces 3D measurement and imaging solutions including portable measurement arms, laser scanners and trackers, among others, generated about $340 million in sales in 2024.
The transaction will boost AMETEK's precision technology portfolio in the electronic instruments division, which produces test and measurement instruments for sectors such as aerospace, medical, research, power and industrial markets.
FARO's shares rose to $42.8 a piece in premarket trading, while AMETEK shares were flat.
AMETEK last week, opens new tab beat Wall Street estimates for first-quarter profit on the back of higher margins across segments, even as the company navigated inflationary pressures in the U.S. and tariff-led market uncertainty.
""We are finding opportunities created by the tariffs to take advantage of our substantial U.S. manufacturing footprint to broaden our customer base and support their growth in the U.S.,"" CEO David Zapico said on Thursday.",n/a
technology,"Chinese companies line up to sell 'innovation bonds', capitalising on Beijing's technology push",https://www.reuters.com/resizer/v2/6WMV6HLTQFKB3HBIMFTNQOF7XE.jpg?auth=f0449219844aa024e9bfdc82b795c5abd2b4f4379b276fa1a95d73fc0e111417&height=1005&width=1920&quality=80&smart=true,https://www.reuters.com/technology/chinese-companies-line-up-sell-innovation-bonds-capitalising-beijings-technology-2025-05-08,"SHANGHAI, May 8 (Reuters) - Chinese banks, brokerages and private equity firms are among companies kicking off plans on Thursday to sell so-called sci-tech innovation bonds.
Beijing published detailed rules on Wednesday for a ""technology board"" in the bond market to fund innovation amid intensifying Sino-U.S. rivalry.
Tech companies can already issue such bonds, but financial companies have become eligible under the new mechanism. China's central bank will provide low-cost funding to support bond sales, while local governments will help share losses in the event of defaults.
It represents China's latest effort towards technology self-sufficiency as Washington steps up curbs against Chinese tech advancement. It is also a boon to private equity and venture capital firms suffering from slow initial public offerings at home.
Industrial Bank (601166.SS), opens new tab, Guolian Minsheng Securities Co (601456.SS), opens new tab and Wuxi Venture Capital Group are among more than a dozen companies announcing plans to issue sci-tech innovation bonds on Thursday.
People's Bank of China Governor Pan Gongsheng said on Wednesday that nearly 100 companies are planning to sell such bonds to raise more than 300 billion yuan ($41.46 billion) in total, and he expects the list to grow further.
""Government support may help whet appetite of risk-averse bond investors,"" said Chen Yuting, analyst at Huafu Securities. ""A booming market would in turn stimulate tech innovation.""
Industrial Bank said it plans to raise 10 billion yuan via bond sales to fund innovative businesses and technology-related loans.
Brokerage Guolian Minsheng aims to issue up to 1.0 billion yuan of three-year bonds, mainly to finance tech-related investments.
Wuxi Venture Capital plans to sell 400 million yuan worth of three-year bonds. Proceeds will be used to swap existing equity investments and invest in new funds.
But there are signs proceeds from the bonds are used nowhere near technology or innovation in some cases.
Xuzhou Construction Machinery Group (XCMGP.UL) said on Thursday it plans to raise 1.0 billion yuan selling sci-tech innovation bonds to refinance bank loans.
Muyuan Foods (002714.SZ), opens new tab said it will use the 300 million yuan from planned bond sales to replenish working capital.
($1 = 7.2367 Chinese yuan renminbi)",n/a
technology,Retired air traffic controller says upgrading technology behind Newark airport failures ‘can't be done quickly',"https://media.cnn.com/api/v1/images/stellar/videothumbnails/50623846-68897775-generated-thumbnail.jpg?c=16x9&q=w_800,c_fill",https://www.cnn.com/2025/05/06/Tv/video/cnn-sitroom-pamela-brown-colin-scoggins-faa-air-traffic-control-newark,"Colin Scoggins, a former FAA military specialist and retired air traffic controller, joined The Situation Room to discuss the staffing shortages and technological failures at Newark Airport.",n/a
technology,Dynavax Technologies: Q1 Earnings Snapshot,https://www.washingtonpost.com/wp-apps/imrs.php?src=https://arc-anglerfish-washpost-prod-washpost.s3.amazonaws.com/public/RUGLRTKULZB6XPESJMXXJVLTDI.jpeg&w=1440,https://www.washingtonpost.com/business/2025/05/06/earns-dynavax-technologies/28b11236-2ab7-11f0-a724-3bc879c9f843_story.html,"EMERYVILLE, Calif. — EMERYVILLE, Calif. — Dynavax Technologies Corp. (DVAX) on Tuesday reported a loss of $96.1 million in its first quarter.
The Emeryville, California-based company said it had a loss of 77 cents per share. Losses, adjusted to extinguish debt, came to 11 cents per share.",n/a
technology,Core Molding Technologies: Q1 Earnings Snapshot,https://www.washingtonpost.com/wp-apps/imrs.php?src=https://arc-anglerfish-washpost-prod-washpost.s3.amazonaws.com/public/RUGLRTKULZB6XPESJMXXJVLTDI.jpeg&w=1440,https://www.washingtonpost.com/business/2025/05/08/earns-core-molding-technologies/208112d6-2c07-11f0-a724-3bc879c9f843_story.html,"COLUMBUS, Ohio — COLUMBUS, Ohio — Core Molding Technologies Inc. (CMT) on Thursday reported profit of $2.2 million in its first quarter.
On a per-share basis, the Columbus, Ohio-based company said it had net income of 25 cents.
The maker of fiber reinforced plastics posted revenue of $61.4 million in the period.",n/a
technology,US expands attempt to blow up Google with proposed teardown of its ad technology,https://www.washingtonpost.com/wp-apps/imrs.php?src=https://arc-anglerfish-washpost-prod-washpost.s3.amazonaws.com/public/SONR3RBKPUI7BJZEHPEHTSPYIM.jpg&w=1440,https://www.washingtonpost.com/politics/2025/05/06/google-ad-network-monopoly-penalty/98a05488-2a7d-11f0-a724-3bc879c9f843_story.html,The U.S. Justice Department is doubling down on its attempt to break up Google by asking it to give up the underlying technology powering the company's digital ad network. The proposed remedy joins a separate federal effort to separate the Chrome browser from its dominant search engine.,n/a
technology,Exclusive: US lawmaker targets Nvidia chip smuggling to China with new bill,https://www.reuters.com/resizer/v2/J4CGVZIH3RNKLHGIDNYUPE2OVU.jpg?auth=bd267e041f8fcd704be610a70a5f27401088d82e3dfe6cbc22befc6419bd31ec&height=1005&width=1920&quality=80&smart=true,https://www.reuters.com/world/us/us-lawmaker-targets-nvidia-chip-smuggling-china-with-new-bill-2025-05-05,"SAN FRANCISCO, May 5 (Reuters) - A U.S. lawmaker plans to introduce legislation in coming weeks to verify the location of artificial-intelligence chips like those made by Nvidia after they are sold.
The effort to keep tabs on the chips, which drew bipartisan support from U.S. lawmakers, aims to address reports of widespread smuggling of Nvidia's chips into China in violation of U.S. export control laws.
Nvidia's chips are a critical ingredient for creating AI systems such as chatbots, image generators and more specialized ones that can help craft biological weapons. Both President Donald Trump and his predecessor, Joe Biden, have implemented progressively tighter export controls of Nvidia's chips to China.
But Reuters and other news organizations have documented how some of those chips have continued to flow , and Nvidia has publicly claimed it cannot track its products after they are sold.
U.S. Representative Bill Foster, a Democrat from Illinois who once worked as a particle physicist, said the technology to track chips after they are sold is readily available, with much of it already built in to Nvidia's chips. Independent technical experts interviewed by Reuters agreed.
Foster, who successfully designed multiple computer chips during his scientific career, plans to introduce in coming weeks a bill that would direct U.S. regulators to come up with rules in two key areas: Tracking chips to ensure they are where they are authorized to be under export control licenses, and preventing those chips from booting up if they are not properly licensed under export controls.
Foster told Reuters that there are already credible reports - some of which have not been publicly disclosed - of chip smuggling occurring on a large scale.
""This is not an imaginary future problem,"" Foster told Reuters. ""It is a problem now, and at some point we're going to discover that the Chinese Communist Party, or their military, is busy designing weapons using large arrays of chips, or even just working on (artificial general intelligence), which is as immediate as nuclear technology.""
Nvidia declined to comment for this story.
Chip smuggling has taken on new urgency after the emergency of China's DeepSeek, whose AI systems posed a strong challenge to U.S. systems and were built with Nvidia chips that were prohibited for sale to China, according analyst firm SemiAnalysis. Prosecutors in Singapore have charged three Chinese nationals with fraud in a case that involved servers that may have contained Nvidia chips.
Though it has not been put into broad use, the technology to verify the location of chips already exists. Alphabet's (GOOGL.O), opens new tab Google already tracks the location of its in-house AI chips and others in its vast network of data centers for security purposes, according to two sources with direct knowledge of its operations.
Google did not respond to a request for comment.
Foster's legislation would give the U.S. Department of Commerce six months to come up with regulations to require the technology.
BIPARTISAN SUPPORT
Foster's bill has support from fellow Democrats such as Representative Raja Krishnamoorthi, the ranking member on the House Select Committee on China. ""On-chip location verification is one creative solution we should explore to stop this smuggling,"" Krishnamoorthi said in a statement.
Republicans are also supportive, with Representative John Moolenaar, who chairs the committee, telling Reuters that ""the Select Committee has strong bipartisan support for requiring companies like Nvidia to build location-tracking into their high-powered AI chips — and the technology to do it already exists.
The technology for verifying the location of chips would rely on the chips communicating with a secured computer server that would use the length of time it takes for the signal to reach the server to verify where chips are, a concept that relies on knowing that computer signals move at the speed of light.
Tim Fist, a former engineer and director of emerging technology policy at Washington think tank Institute for Progress, said such tracking would provide a general, country-level location for chips. But that is far more information than the Bureau of Industry and Security, the arm of the U.S. Commerce Department responsible for enforcement of export controls, currently has.
""BIS has no idea which chips they should be targeting as a potential high priority to investigate once they've gone overseas,"" Fist said. With location verification, ""they now at least have bucketed the set of chips that are out there in the world into ones that are very likely to not have been smuggled and ones that warrant further investigation.""
Foster's second legislative goal of preventing AI chips from booting up if they are not properly licensed under U.S. export controls would be more technologically complex to implement than location verification, but he said the time has come to begin discussions for both efforts.
""We've gotten enough input that I think now we can have more detailed discussions with the actual chip and module providers to say, 'How would you actually implement this?'"" Foster told Reuters.",n/a
technology,Lesaka Technologies: Fiscal Q3 Earnings Snapshot,https://www.washingtonpost.com/wp-apps/imrs.php?src=https://arc-anglerfish-washpost-prod-washpost.s3.amazonaws.com/public/RUGLRTKULZB6XPESJMXXJVLTDI.jpeg&w=1440,https://www.washingtonpost.com/business/2025/05/07/earns-lesaka-technologies/fb95a834-2b9c-11f0-a724-3bc879c9f843_story.html,"ROSEBANK, South Africa — ROSEBANK, South Africa — Lesaka Technologies, Inc. (LSAK) on Wednesday reported a loss of $22.1 million in its fiscal third quarter.
On a per-share basis, the Rosebank, South Africa-based company said it had a loss of 27 cents. Earnings, adjusted for non-recurring costs and stock option expense, came to 4 cents per share.",n/a
technology,"New dashboard, phone alerts from Massachusetts State Police have reached nearly 1 million drivers",https://assets2.cbsnewsstatic.com/hub/i/r/2025/05/06/66038f04-94c7-4e15-9d74-5cf7d7174771/thumbnail/1200x630/f1f895acd0ae01bfd929792bdc2a65c4/emergency-vehicle.jpg?v=8782d831dd587e69db5d043c0a4c5f4b,https://www.cbsnews.com/boston/news/safety-cloud-alerts-massachusetts-state-police-dashboard,"As WBZ-TV's I-Team exclusively reported last month, Massachusetts State Police are using new technology to send alerts directly to drivers' car dashboards and phones about nearby emergency vehicles. The agency announced Tuesday that notifications from the ""Safety Cloud"" system have now reached 900,000 drivers after 12 weeks of operation.
The program, paid for with a $135,000 federal grant, is installed in 233 State Police cruisers that patrol the state. The goal is to cut down on crashes involving first responders.
Police say their conventional lights and sirens don't always get the attention of drivers because cars are becoming more sound-proof and people are increasingly distracted by their phones.
""This innovative new technology will save lives,"" Gov. Maura Healey said in a statement. ""It protects law enforcement and first responders when they're responding to emergencies on our roads, while also making it safer for nearby drivers and pedestrians.""
Safety Cloud alerts
When a trooper equipped with the new technology turns on their lights and sirens, a transponder is activated and a digital alert is sent to drivers in the area that shows up in the car's infotainment system or a navigation app like Waze.
The alert will pop up for drivers about 30 seconds before they encounter an emergency vehicle that's on the side of the road or approaching them.
""By providing automatic, advanced notice to drivers approach an emergency scene or a responding vehicle, we hope they can use good judgement and take action to move over, slow down, and pay extra attention to their surroundings,"" State Police Col. Geoffrey Noble said.
Last year, there were 42 incidents where a driver crashed into a stationary cruiser, State Police said.
State police are not the only agency in Massachusetts using the system made by HASS Alert. The I-Team reported that more than 90 other first responders and tow companies have deployed the technology.",n/a
technology,AI execs used to beg for regulation. Not anymore.,https://www.washingtonpost.com/wp-apps/imrs.php?src=https://arc-anglerfish-washpost-prod-washpost.s3.amazonaws.com/public/OTDN2RP7IYB35JYCHSMISVME34.JPG&w=1440,https://www.washingtonpost.com/technology/2025/05/08/altman-congress-openai-regulation,"Sam Altman, CEO of ChatGPT-maker OpenAI, warned at a Senate hearing Thursday that requiring government approval to release powerful artificial intelligence software would be 'disastrous' for the United States' lead in the technology.
It was a striking reversal after his comments at a Senate hearing two years ago, where he listed creating a new agency to license the technology as his 'number one' recommendation for making sure AI was safe.",n/a
technology,"Hong Kong launches new measures to attract more tech, bio listings",https://www.reuters.com/resizer/v2/DUSI46GGSVKF5JHN3R7XLCCROE.jpg?auth=88c49e0f174ed7fb468f7715d1c3013bc21f99ef4f84fa4c4c2de5138689c9fe&height=1005&width=1920&quality=80&smart=true,https://www.reuters.com/business/media-telecom/hong-kong-launches-new-measures-attract-more-tech-bio-listings-2025-05-06,"May 6 (Reuters) - Hong Kong launched a scheme on Tuesday to offer smoother listings for tech companies on its stock exchange, as it looks to capitalize on Chinese companies' growing appetite to raise funds offshore.
The new ""technology enterprises channel"" will make new listings easier for specialist technology and biotechnology firms, the bourse operator and Hong Kong's Securities and Futures Commission said in a joint statement.
Under the scheme, the exchange, a unit of Hong Kong Exchanges and Clearing, (0388.HK), opens new tab will provide guidance on the eligibility and suitability for listing for prospective companies.
Applicants can confidentially file for initial public offerings, as disclosures of their operational strategies may pose heightened risk compared to other industries, the statement said.
It also allows tech firms to list with a weighted voting rights (WVR) structure, which allows companies to hold shares that carry extra voting rights, provided they meet certain requirements.
Hong Kong is the main destination for mainland Chinese firms looking to raise capital offshore, and bankers have said that mainland firms, mainly those in the tech sector, are accelerating plans to raise money offshore.
Hong Kong authorities had first announced the technology enterprises channel in February.",n/a
